type,title,description,qualifications,postedQuarter,postedDate,is_suitable
Full Time,081 ft FMAP-Financial Management Acceleration Program,"Job Title: FMAP-Financial Management Acceleration Program
Job ID: 4918-08
Work Location: Houston, TX or Olean, Wellsville, Painted Post, NY US
# Positions: 4
 
Overview:
Dresser-Rand Company is a diversified and global recognized leader in the design and manufacture ocating compressors and turbines. Dresser-Rand is seeking entry level accountants for our Financial Management Acceleration Program (FMAP).

The Financial Management Acceleration Program (FMAP) is a three year rotational assignment that allows exposure to many accounting and finance disciplines within Dresser-Rand. 
The candidate will use fundamental accounting and finance concepts and principles to complete various job assignments while learning about the company. Areas of the financial organization that an FMAP candidate may gain exposure to include topics such as: Audit, Project and Manufacturing Cost Accounting, Treasury, Banking and International Cash Management Activities, Corporate and Business Unit Accounting, Credit and Collections, Forecasting and Budgets, Tax Accounting, and Sarbanes-Oxley and Corporate Governance issues, and Internal & External Financial Reporting. Assignments may be in the Southern Tier of Western New York, Houston, Texas, and LeHavr r preference, ability and company need.

Dresser-Rand feels that this program is a great way to get the most exposure to the whole company and give the new employee an opportunity to see how everything works.
 
Responsibilities:
Desired Background/Education:

BS, MS Degrees in Accounting
Twenty-one (21) hours of accounting courses required.
Two summer internships, cooperative education experience or 1-3 years prior work experience required.
Willingness to relocate throughout the US (generally move 2 times) and willingness to travel.
3.2 GPA preferred.","Critical Competencies:

Hardworking and self-motivated
Enthusiastic
Results-driven
Communication/interpersonal skills
Ability to multi-task
Strong Technical/Mecha e=""margin: 0px""> 
This is an auto-generated message, please do not reply.",12/23/54,9/17/08,1
Full Time,091 ft Application Engineer - Autodesk,"EMA Design Automation is a full-service provider of Electronic Design Automation (EDA) solutions including a complete range of software tools, consulting services, product training, and technical support for the entire PCB and custom integrated circuit design process. EMA is a Cadence&#194;&#174; Channel Partner serving all of North America and has been a Cadence distributor since 1998. EMA manufacturers TimingDesigner, a static timing analysis solution, and distributes it globally through a worldwide network of value added resellers. EMA has expanded its portfolio to include Autodesk MSD products. It is a privately held corporation headquartered in Rochester, New York. Visit EMA at www.ema-eda.com for more information.

We are seeking a full-time CAD Application-Engineer with strong mechanical design expertise in the manufacturing environment.
ESSENTIAL DUTIES AND RESPONSIBILITIES
The Applications Engineer will work closely with EMA Design Automation Sales Professionals and clients to enhance our existing sales and services business. The primary responsibilities of this position are consulting, implementation and training related to Autodesk developed manufacturing applications (Autodesk Inventor Suites, AutoCAD Mechanical, Autodesk Vault, and AutoCAD Electrical.) These require the ability and willingness to:
Determine and qualify proposed solutions to manufacturing industry needs. 
Effectively communicate these solutions through sales demonstrations and classroom instruction. 
Troubleshoot and provide on-site technical assistance to customers relative to application use.
Rapidly enhance technical skills on a continuing basis, such as mastering new software packages and version updates.
Deliver technical training for internal sales/marketing teams and external clients. 
Develop company;s expertise for Autodesk;s manufacturing applications mentioned above via training / mentoring.","REQUIREMENTS
BSME and  5 years industry experience desired
Expertise with Autodesk Inventor is a must; experience with Digital Prototyping and competitive products (Solidworks, Pro-E) is a plus.
Autodesk Certification for Inventor / AutoCAD is a plus. 
Experience in manufacturing design, manufacturing engineering, technical sales environment is a plus. 
Strong communication and client service skills. 
Strong organizational, problem solving and time management skills.",1/2/55,11/6/09,1
Full Time,Corporate Recruiter / HR Specialist,"Primarily responsible for recruiting exempt and non-exempt, technical, sales and administrative positions for Corporate and all branch offices. Acts as a coordinator by planning, arranging, and carrying out creative, efficient, and effective recruiting events and process in order to meet current and future human resource needs. The secondary responsibility is, by acting as a change agent, to initiate, facilitate, and execute other HR related projects for the purpose of realizing the company strategy and goal. 

Duties and Responsibilities:
1) Identifies and recommends appropriate Internet recruitment sites, colleges, job fairs, and/or reputable agencies for recruitment in timely manner,
2) Creates and posts accurate and appealing job opening descriptions and necessary promotional materials onto strategic sources,
3) Conducts resume screening and interviews with job applicants,
4) Coordinates interviewing schedule with hiring managers for new and internal job posting applicants,
5) Conducts reference checks on applicants, 
6) Administers tests to candidates,
7) Determines the suitability of job applicants for the open positions in consultation with Asst. HR Manager and/or hiring managers,
8) Maintains good communications with prospective candidates, recruiting agencies, college career service staff, and hiring managers,
9) Persuasively conveys job offers to applicants so that they accept the offers,
10) Researches and identifies appropriate salaries/compensation packages,
11) Prepares necessary documents and files on recruiting, hiring, and staffing such as new hires personnel files, recruiting log, and/or status report,
12) Negotiates equitable placement fees and bill rates with recruiting agencies,
13) Proactively identifies, assesses, and analyzes the potential change and improvement needs in HR function of the company 
14) Develops, recommends, implements, and evaluates interventions or projects to meet the needs in collaboration with other departments, company management, and/or external experts,
15) Travels to career fairs, colleges or other locations for recruiting and other HR project purposes
16) Understands and observes governing federal and state laws and regulations and, 
17) Understands and observes company and department policies and procedures.","1) 4 year degree in business or related field or 3+ years experience in human resource field,
2) Knowledge on planning and managing HR process and activities including recruiting in compliance with pertaining laws and regulations, 
3) Skills to identify crucial positive attributes within candidates through recruiting process, 
4) Strong written and verbal communication skills to communicate, persuade, and negotiate effectively with other departments, branches, applicants and agencies,
5) Ability to quickly and effectively perceive and connect with people including but not limited to job applicants, hiring managers, college administrators, agencies, and external experts, 
6) Ability to recruit high-caliber candidates to directly contribute to the companys goal attainment,
7) Ability to handle multiple projects to meet companys human resource needs and,
8) Ability to work interdependently.",12/4/54,12/9/06,1
Full Time,104 ft Electrical Engineer ; Power Supply Design Engineer,"About Lexmark

Lexmark International, Inc (NYSE:  LXK) provides businesses of all sizes with a broad range of printing and imaging products, solutions and services that help them to be more productive.  In 2009, Lexmark sold products in more than 170 countries and reported $4.0 billion in revenue.  Learn how Lexmark can help you get more done at www.lexmark.com.

Description:  Electrical Engineer ; Power Supply Design Engineer

Level:  Hardware Engineering-Prof-1 

Job location is Lexington, Kentucky.  This position is advertised at an entry level, but may be filled at an intermediate level depending upon candidate education and experience 

Responsibilities:
Explore and develop new AC/DC power supply technologies for high efficiency and high frequency / high density requirements.
Deliver off-line switch mode power supply designs that meet technical, manufacturing, and cost requirements. 
Validate power supply designs through engineering analysis and testing.
Research and evaluate components, manage design process and documentation, and support new product introduction into manufacturing.
Other power system and power electronics engineering analysis as assigned.","Qualifications:
Have at least a BSEE degree, MSEE a plus, from an accredited university, with a focus on power electronics.
2+ years of work experience, or equivalent academic research, in high frequency off-line switch mode power supply design.
Design familiarity with power semiconductors.
High frequency transformer design experience, EMC filter design experience, thermal design experience, power conversion topology knowledge/experience.
Analog design skills, closed loop control design skills, digital controls.
Simulation tools such as PSpice, MathCad.
Printed circuit board layout experience.
Experience with design for manufacturing and compliance with FCC and safety standards is a plus.
Good communications skills and able to work effectively in a team environment.
Must have permanent US work authorization.",1/14/55,5/16/11,1
Full Time,Fulltime - Financial Operations Review Analyst,"Grow Further with Brown & Brown;s Internal Audit Leadership Program!

Brown & Brown;s Financial Operations & Leadership Program operating out of our Roseland, NJ and Orlando, FL, and offices allows individuals to learn about the insurance industry and grow within the company. Auditors are responsible for working in a team environment which consists of planning, performing fieldwork, and reporting of Financial, IT, and Operational Reviews of the Brown & Brown Profit Centers. 

Sales, Operations, & Accounting Track

The sales, operations, & accounting track of Brown & Brown;s Financial Operations & Leadership Program is a program designed to prepare individuals for a successful sales, operations, or accounting career within the company. The program enables individuals to obtain necessary designations which will assist in their advancement within the insurance industry while introducing them to the multiple lines of business within Brown & Brown.","Required Competencies:
4 year college degree; Accounting or Finance preferred
Proficient in Microsoft Office, Excellent written and verbal communication skills
Highly motivated team player, self-disciplined with great desire to learn
Ability to meet tight deadlines and prioritize workload
Candidate must be willing and available to travel 50;60%.",3/17/55,2/13/17,1
Full Time,Quality Systems Specialist level 1 - The Boeing Company,"This position is an entry level position with the quality organization supporting the H-47 helicopter program. This job will entail direct involvement with product build teams, and support groups such as; engineering, planning, supply chain management. The general requirement for this posting is to assist in the monitoring and validating of corrective action activity that sustains and improves the quality of our products and enhances value of our product with the customer. More specifically assignments could include but are not limited to assist in retrieval, and review of raw data and analysis, assist with troubleshooting and validating completion of corrective actions, and interacting with internal and external customer representatives and participation in the Material Review Board process.","ADAPTABILITY/FLEXIBILITY: Ability to be flexible in response to changing circumstances or conditions, be receptive to feedback and coaching, and be resilient to constraints, frustrations and/or adversity. 

ATTENTION TO DETAIL: Attend to and verify the accuracy and completeness of detailed information. 

COMMUNICATION: Listen effectively, speaks with clarity and precision, writes clearly and concisely. 

CUSTOMER SATISFACTION: Meets commitments to customers on time and uses customer feedback. 

DEPENDABILITY: Willingness to take ownership of work activities and ensure they are completed accurately, efficiently, and in a timely manner. 

INFORMATION TECHNOLOGY FLUENCY: Operate relevant personal computing hardware (e.g., personal computers, printers, storage media) and standard software (e.g., word processing, graphics packages, spreadsheets/databases). 

INITIATIVE: Willingness to take independent action and to seek out additional assignments or tasks. 

INNOVATION/CREATIVITY: Challenge the 
status quo by developing and applying creative and innovative processes in unique environments or situations. 

INTEGRITY: Demonstrates high ethical standards. 

TIME MANAGEMENT: Ability to plan and organize time to work both productively and efficiently as well as maximize the quantity and quality of work. 

TECHNICAL COMPREHENSION: Ability to communicate with technical personnel and assimilate technical information. 

Education: Bachelors degree and typically 1 year work related experience; or equivalent combination of education and experience. ",12/5/54,5/15/07,1
Full Time,"054 ft Manager, Planning & Logistics Manufacturing","Reports to: VP, Operations &#150; Jim Boyle

 

Areas of Responsibility

Main responsibility will include keeping track of internal and external department flow with regards to maintaining all schedules and making sure that all projects proceed as planned.  This involves active coordination with the printers, production, editorial and sales logistics. This will encompasses: 
Chairing of Weekly Printer Meeting 
Coordinated oversight contractual deadline obligations to printers with Managing Editor and Production. 
Coordination of scheduling with the VP of Publishing Operations and Accounting so as to ensure that Marvel maximizes all contractual discounts and rebates with printers. 
Act as the first line of PO/Invoice reconciliation with Logistics Coordinator & Accounting. 
Act as primary liaison with the Manager of Purchasing & Inventory Planning for all publishing programs involving POP, Merchandise units, marketing materials and customized inserts. 
Supervisory oversight of Print Coordinators who will handle all of the daily activity associated with the comic books, custom comics, trade paperbacks, hard covers, digests, and any other formats or offerings that are standard course of business. 
Assist Manager of Purchasing & Inventory Planning with pricing of custom comics and other special projects.  Will coordinate follow-up with all proofs/details with sales and advertising coordinator on an as needed basis. 
Reviews all changes in pricing database prepared by the Manager of Purchasing & Inventory Planning. The Manager will review summary sheets prepared by Logistic Coordinator for hard covers, trades and special projects prior to submission to printers. 
Involved in training of staff in comic book and book manufacturing and general procedures, will work with Managing Editor and Director of Production to create a procedure manual for Publishing Operation. 
Participate in annual printer reviews and paper testing.",,11/26/54,7/24/06,0
Full Time,Fulltime - Multimedia Coordinator,"Multimedia Coordinator 

About the Position

Global manufacturing company is seeking a tech savvy individual to join creative team as a full time photographer/videographer. In this role you will be responsible for creating and producing media projects for campaigns, marketing and general branding of the company. The ideal candidate is someone who has a deep knowledge of photography/videography techniques and practices and is proficient in Adobe Creative Suite. When not operating a camera, you will be assisting the marketing team with their various projects and needs. 

Additional responsibilities include: 

Must be able to operate photo/video camera for shooting assignments
Edit content according to vision of internal client
Assist with graphics design assignments according to corporate brand guidelines 
General understanding of marketing and communication methods

Job Status

Full-Time 
40-60k DOE
Benefits included","Qualifications

Bachelor;s Degree in Photography/Video Production/Media or Bachelor;s Degree in graphic design/related field
Proficient in Adobe Creative Suite; Web experience is a plus 
Strong Adobe Photoshop /After Effects skills required
Excellent interpersonal communication skills
Must be able to take initiative, have enthusiasm in projects and have a good sense of humor!
Self- Motivated, detail oriented",3/10/55,7/13/16,1
Full Time,Fulltime - Inside Sales Rep,"Support of the sales organization by providing sales support for our resellers. That includes: providing small quotes (>32 doors or >32 cameras) for VARs or Lenel field sales, direct selling of products to VARs within their regional responsibility, promoting new product introductions to Lenel;s customers, communicating updates and/or changes to products, responding to routine sales leads from internal or external sources as well as providing MFA and attend to customers; service needs (ie, tracking PO;s). 

Responsibilities will generally focus on one or more of the following: 

Telemarketing 
E-Sales 
Short-term sales initiatives/campaigns 
Communicate Promotions, new product introductions or updates 
80% of calls will be outbound to customers with minimum call expectations set 
East Inside Sales Representative will be required to work 8am-5pm 
Central Inside Sales Representative will be required to work 9am-6pm 
West Inside Sales Representative will be required to work 11am-8pm 
Responding to inbound email and phone calls; No cold calling component 

Level of Responsibility: 

Responsible for small projects or multiple tasks within functional discipline 
Makes significant contribution to their team by applying their knowledge of the discipline 
Works with moderate guidance on projects with short-term focus 
Has a solid understanding of the fundamentals of the discipline and role&#226;&#128;&#148;continuing to develop specialized knowledge","Experience/Qualifications     Fluent in Spanish, Portuguese preferred 
Proficiency in computer based terminology and applications 
Knowledge of IP video components including cameras and video recorders 
Knowledge of thermal dye sublimation printers, related media configurations 
Knowledge of database applications and related integrated applications 
Knowledge of hardware peripheral components and related integration applications 
Knowledge of ID card technologies and applications 
Knowledge of Biometric interface devices 
Knowledge of LAN and WAN topologies 
Knowledge of Lenel product portfolio 

Technical / Personal Skills 
Ability to speak in front of small and large audiences 
Must be able to prepare and implement presentations to large audiences (10-100) to include related marketing activities, materials acquisition and configuration, and follow-up programs 
Proven ability to adapt quickly to emerging technologies 
Ability to establish priorities and work independently, and also must work well in a team environment 
Proven technical ability to review detailed software specifications and proposal preparation 
Customer empathy - ability to listen, understand, and be advocate of needs, and motivations of both internal and external customers",2/11/55,10/15/13,0
Full Time,FULLTIME - Junior Network Engineer,"SIG is a trading firm that uses the latest technology to build systems that drive our success in the markets. We rely on ingenuity, collaboration and flexibility in our engineering methods and priorities.  When we design our systems, we focus on every layer of the stack. Experts in networking, platform, security, and software work together to build our high performance software solutions.

Networking at SIG:

We continue to expand our network infrastructure and invest heavily in advancing technology. At SIG, you will gain exposure to a large and complex network topology. Our Network Services team is responsible for monitoring, maintaining and providing support for the firm;s global enterprise network.  There is always active collaboration between technology and business teams to coordinate configuration changes, provide root-cause analysis, recommend network optimizations, and participate in firm wide projects including upgrading and implementing new hardware and software.

We troubleshoot issues that could include local/wide area networks, OSI Layer 1-3, wireless networks and third-party vendor connections in a multi-vendor environment across multiple Data Center locations. 

How You;ll Learn:

At SIG, you learn the most by doing. With guidance and mentoring from your team, you;ll get hands-on experience beginning on your first day.  In addition, your team lead will work with you over your first 18-24 months to create a customized development plan.  The plan will focus on helping you get to know the people you;ll be working with, what your team is responsible for, and our technical environment.  

Here are some examples of how we facilitate learning every day:

You;ll work with senior team members in projects and problem resolution
We have weekly team whiteboards to discuss new hardware, concepts, projects or complex problems
The door is always open. You;ll have endless opportunities to ask questions
We have an open space floor plan that allows for an easy flow of information between team
Based on your learning and development plan, you may also attend internal classes, spend time with other teams, or rotate through different responsibilities within the networking team

Our Advice:
Be curious
Know what you know;and what you don;t know
Speak up
Persevere
Collaborate
Be accountable for your work
Explore forward

SIG Perks
We;re relaxed ; you can wear jeans and sneakers every day and shorts in the summer 
You can visit our fully stocked kitchens for drinks, snacks, and breakfast. Enjoy our catered lunches every day
Explore Philadelphia using discounts to local restaurants, museums, travel and other attractions
You can use SIG;s gym for work-outs or fitness classes (even at night or on weekends)
We want to make your life easier so take advantage of our on-site services including the barber, dry cleaning and laundry, auto repair and detailing, and more

Check out www.sig.com for more information",,,,1
Full Time,092 ft Project Coordinator,"Project Coordinator
Tracking Code
2010011 
Job Description
BROAD FUNCTION:
Aids the project management function by providing day-to-day task support.  Ensures activities meet set goals and objectives, specifications, and schedule requirements.
 
PRINCIPAL DUTIES AND RESPONSIBILITIES:
1.Provides project support to Project Management Engineers, consisting of, but not limited to executing and monitoring day to day tasks and commitments, preparation of basic reports, and project schedule maintenance.
2.Supports the preparation of customer status reports by providing appropriate data.
3.Utilizes standard planning and scheduling tools as appropriate to efficiently manage day to day tasks. 
4.Ensures execution of the tasks will meet project goals and objectives, which include but are not limited to customer specifications, quality standards, internal design standards, schedule commitments or other stated requirements.
5.Complies with and supports company policies and programs regarding safety, security, ISO, EEO, OSHA and the Code of Ethics and Business Conduct.
6.Performs all other related duties as assigned.
Required Skills
JOB KNOWLEDGE SKILLS AND ABILITIES:
1.Takes full responsibility for assigned projects and tasks.
2.Must have the ability to effectively convey pertinent information verbally and in writing to project team and others in a constructive manner.
3.Capable of executing tasks on schedule; maintains organized records and works systematically and efficiently.
4.Identifies and participates in problem solving activities.
5.Able to effectively handle and keep track of a variety of assigned tasks.
6.Resolves or escalates issues in a timely manner; often involves manager and project team.
7.Actively pursues opportunities to expand job-related knowledge.
Required Experience
MINIMUM QUALIFICATION REQUIREMENTS:
Education:         Associate degree in a relevant technical field.
Experience:       Engineering support and/or product test
This position also requires the ability to work on Defense and Satellite programs subject to ITAR regulations, therefore candidates must be a U.S. Citizen or a U.S. Permanent Resident (&#226;&#128;&#152;Green Card;).",,1/3/55,12/2/09,1
