type,title,description,qualifications,postedQuarter,postedDate,is_suitable
Full Time,Fulltime - Human Resources Analyst,"Brown & Brown;s business model includes an Internal Operations Review Team. This position is responsible for assistance with reviewing all human resource activities throughout our 200+ locations over a 2-3 year period. Up to 75% travel will be required. Initial relocation to Syracuse, NY is required for the 2-3 year period. After successful development within the Brown & Brown business culture and execution of key job elements during this timeframe, this position would roll-out to a position in one of our many subsidiary offices or with our corporate team, either of which may require relocation within the U.S.

Primary Responsibilities:
Responsible for reviewing all human resource activities to include employment, compensation, benefits, and training and development for all existing offices.
Develop and maintain relationship with internal operating divisions.
Assist with FLSA evaluations of job positions of all existing offices.
Assist with transition of documentation of job positions and job evaluation systems for all existing offices.
Analyze and review payroll processes.
Provide advice, assistance and follow-up on company policies, procedures, and documentation.
Recommend and advise on maintenance of human resource, payroll, and benefits systems.
Recommend policy and procedural improvements for all existing offices.
Other duties as assigned.


Brown & Brown is an Equal Opportunity Employer. We take pride in the diversity of our team and seek diversity in our applicants.","Requirements - Education, Experience, and Skills:
Bachelor;s degree or equivalent in Human Resource Management or related field.
1-3 Years experience preferred
Successful completion of PHR exam (preferred)
Knowledge of employment law and other government (state and federal) compliance regulations.
Proficiency in Microsoft applications (Word, Excel and PowerPoint)
Ability to objectively coach employees through the acquisition process.
The ability to research and analyze various types of Human Resource data.
Must have the ability interpret and translate procedures, regulations and/or government law.
Ability to work independently, organize, and prioritize work effectively.",3/13/55,10/10/16,1
Full Time,102 ft Marketing / Sales - Chemical Materials,"A New York based major international manufacturer producing variety of industrial/chemical materials and instruments such as but not limited to materials for semiconductor production, thermal function filters, ceramics, lithium battery materials, high-quality chlorinated polyethylene, chloroprene for the industries of chemical, biological, medical, food, materials, electronics, energy and academic, etc. http://www.showadenko.us/en/index.html

Main Job Functions:

&#194;&#183;Responsible for both marketing development and sales activities including marketing planning, market research, visiting clients and developing market sharing of chemical material products for fuel cells, lithium batteries, cosmetics, food ingredients, ceramics, semiconductor production, and others.
&#194;&#183;Covering clients in various industries currently and potentially using chemical material products of the company for producing end products of each clients/each industries.
&#194;&#183;Some of the current and potential clients/industries are chemical, biological, food, medical, materials, electronics, energy, aerospace, research organizations, R&D and lab in universities and research organizations, etc.
&#194;&#183;Covering mainly the US and Latin American clients/markets for developing new business.
&#194;&#183;Providing technical support to clients by providing technical advices and solutions to meet their demands. Some business travels required.
&#194;&#183;Bring back the ideas and demands of clients to the product development team of the company to put those ideas into new and improved products and services. 
&#194;&#183;Occasionally attend conferences and trading shows to promote company products.
&#194;&#183;Occasionally business trip to Japan may be required to visit company;s factories and the headquarter office to discuss about company;s products development and business development.","Requirements:

&#194;&#183;More than 3 years of experience in marketing and sales is required. Experience in the field of chemical products is preferable (not required).
&#194;&#183;Knowledge and/or experience of marketing development.
&#194;&#183;Self-motivated to marketing/sales activities.
&#194;&#183;Native level English language skill is required.
&#194;&#183;Business level Spanish language skill is required.
&#194;&#183;Portuguese language skill is additionally considered (not required).
&#194;&#183;Some Japanese language skill or related experience with Japan may be preferably considered (not required).
&#194;&#183; Strong communication and presentation skill with appropriate business manner to maintain good relationship with clients and co-workers is required. Team-player is a must.
&#194;&#183;BA, BS, MA or MS degree with marketing, chemistry, biochemistry, biology, materials science, material engineering, material science, chemical engineering, electronics/electrical engineering or other related field is required.
&#194;&#183;Start in February 2011.


To apply: Email resume to fujimoto@bloomjob.com or contact Mr. Fujimoto at 212-512-0575, Bloom Consulting, an executive search firm that is the HR representative of Showa Denko America Inc.",1/13/55,12/15/10,1
Full Time,Fulltime - ARD Quality Analyst I,"Note: Contact listed on this posting is for inquiries only. To be considered for a position, you must complete an application online. Please visit www.excellusbcbs.com/careers Under the guidance of the Manager, Analysis and Recovery, and in accordance with sound and ethical procedures, objectives and controls, the Quality Analyst is responsible for planning, organizing, and performing audit assignments, internal reporting, and follow-up on specific audit assignments. Audits and analyzes claims for recovery efforts, both internal and vendor identification, to validate appropriate billing and payment of our member;s health benefits in accordance with: Contract terms, nationally accepted coding standards and governmental regulations. The analysts also assist with the performance of Cost Avoidance reviews as requested. Essential Responsibilities/Accountabilities: Quality Analyst I:  Performs recovery audits, both internal and vendor identification; by reviewing claim payments to validate appropriate billing and payment of our member;s health benefits in accordance with: Contract terms, member and provider, internal processing guidelines, nationally accepted coding standards and government regulations.  Audits, evaluates and researches compliance with corporate contracts; provider and member, internal processing guidelines, regulatory mandates and corporate policies, through contact with appropriate parties to obtain pertinent information.  Facilitates the set up of audits  As appropriate, notifies the provider of audit findings giving them the opportunity to appeal within a designated time frame.  Submits adjustments to the appropriate department to accurately reflect the services rendered and/or reimbursement.  Works collaboratively with other departments to ensure the appropriate payment of claims  Acts as an information resource to the organization, conduct and participate in cross-training programs.  Remains current with relevant legislative and regulatory mandates to ensure activities are in compliance with these requirements. Also, be aware of all local, regulatory, operational, and national policy changes.  Adheres to and meet established deadlines as required by management.  Creates intra-departmental reporting consisting of data input to document monthly work.  Proposes recommendations for system enhancements, workflow modifications, processing guidelines, system documentation and/or training documentation.  Consistently demonstrates high standards of integrity by supporting the Lifetime Healthcare Companies; mission and values and adhering to the Corporate Code of Conduct.  Maintains high regard for member privacy in accordance with the corporate privacy policies and procedures.  Regular and reliable attendance is required.  Perform other functions as assigned by management. Quality Analyst II: Performs similar functions as the Quality Analyst l, and can be differentiated by the following:  Assists with the training of the Quality Analyst I staff.  Analyzes data, identify trends, and make recommendations in regards to proposed audits  Performs consulting duties that improve operational effectiveness and assist in the development or modification of processing guidelines, workflow modification, system enhancements and system documentation to improve operational reliability and efficiency.  Conducts special projects in the areas of data collection and analysis at the request of management. Quality Analyst III: Performs similar functions as the Quality Analyst l & II and can be differentiated by the following:  Provides direction and team leadership in the absence of Quality Analyst Manager/Supervisor or Lead Quality Analyst.  Coordinates special projects and/or audits for cross-regional functions across all Health Plan regions.  Acts as the lead on data collection and analysis as directed by Management.  Prepares and have the capacity to make presentations as requested or deemed necessary by department management.","Quality Analyst I:  Bachelor Degree with proficiency in mathematics/statistics or related field and a minimum of 3 years progressive experience within the corporation or related field. In lieu of degree, a minimum of 11 years progressive experience within the corporation or related field.  Must have the ability to complete thorough research, exercise good judgement and work independently.  Must have a working knowledge of PC;s and Microsoft Office applications.  Must possess effective verbal and written communication skills.  Must have good, demonstrated interpersonal relations skills. Quality Analyst II: All Quality Analyst I qualifications, plus:  Minimum 5 years progressive experience within the corporation or related field.  Minimum of 2 years of experience conducting quality analytics.  Thorough knowledge of all lines of business, policies and procedures.  Must have advanced skills of PC;s and Microsoft Office applications.  Strong and effective analytical skills are required, along with the capacity to identify and understand business objectives.  The ability to perform sound data analysis and problem-solving skills that include making recommendations to change or improve operational processes. Quality Analyst III: All Quality Analyst I & II qualifications, plus:  Minimum 7 years progressive experience within the corporation or related field.  Minimum of 4 years of experience conducting quality analytics.  Professional certification as a CPC, CIA, CQA or other Certifications (i.e. PAHM, FAHM, etc.) is preferred.  Must have advanced skills of PC;s and Microsoft Office applications, including MS Power Point  Must possess leadership skills as well as the ability to effectively manage people and multiple projects.  A demonstrated aptitude and interest in supervision.  Relies on extensive experience and judgment to coordinate, plan and perform daily analysis work. Physical Description: In support of the Americans with Disabilities Act, this job description lists only those responsibilities and qualifications deemed essential to the position. Equal Opportunity Employer",2/18/55,8/19/14,0
Full Time,Entry Level Software Engineer-General Dynamics C4 Systems-F/T,"General Dynamics C4 Systems designs, develops, and integrates highly sophisticated command, control, and communications systems for the U.S. military, federal agencies, civil governments and related international customers. These state-of-the-art systems combine advanced imagery software and multi-sensor integration to provide real-time situational awareness to tactical decision makers. Our systems transform large amounts of complex data into useful information that is clearly and intuitively presented to the operators, enabling commanders make informed decisions in real-time. We build systems for a wide range of global missions including wartime battlefield management, crisis management, peace keeping and contingency operations, drug intervention, and public safety.

Multiple openings for entry-level Software Engineers responsible for the development of software and systems products in a UNIX, Linux and/or Windows-based workstation environment. Desired skills include object-oriented software development, C#/C/C++/Java software language proficiency, Web Services and design of systems utilizing real-time, distributed microprocessor or DSP-based processing. Candidates will be involved in all phases of the development process including but not limited to: requirements analysis, design, code and unit test, integration and systems test, and design support activities.","BS or MS in CSE/CS/CE. Experience with software programming languages such as C#/C/C++ /Java is desired but not mandatory. Experience with Web Services, UNIX, Linux, and/or Windows and/or real time OS desired but not mandatory. Strong interpersonal communication skills, problem solving skills as well as the ability to work in a small team environment are desired. Some travel may be required. All applicants must be capable of obtaining a US Security Clearance.

Applicant must be capable of obtaining a US Security Clearance. 

Applicant must be a US Citizen.",12/13/54,9/5/07,1
Full Time,103 ft Mechanical Engineer,"The Dennis Group is currently seeking Engineers for the position of Mechanical Engineer.  Headquartered in Springfield, Massachusetts, with offices in for the Solana Beach, CA and the Salt Lake City, UT; The Dennis Group is a national engineering firm which offers complete planning, process engineering, facility development, and construction management services exclusively to the food and beverage industries.

Preferred candidates should have a fundamental understanding of building energy load calculations, HVAC systems, and fluid flow.  Skills should also include problem analysis and solution: including the problem statement, data gathering, the actual calculation, and the summary/recommendation.  

Mechanical Engineers would be expected to accomplish the following tasks:
 Review heating/cooling loads
Perform code review for plumbing & HVAC systems
 Perform envelope & energy calculations
 Perform drainage & line loss calculations
 Size and Specify HVAC & plumbing equipment
Requirements: 
Proficiency with MS Office (Excel, Word, Access); MS Project, AutoCAD
Strong technical writing skills
Preferred 3+ years of experience and/or internship(s) in an industrial manufacturing setting
Minimum of a Bachelors; degree required 

Mechanical Engineering graduates with an EIT are a plus.

Successful candidates will be professional, self-motivated, energetic and enthusiastic with excellent communication and inter-personal skills. 

The Dennis Group is not accepting applications from candidates who will require visa sponsorship.  Only candidates who are U.S. Citizens, lawful residents, or are otherwise authorized to work in the US without employer sponsorship will be considered.

Please submit Resume, Cover Letter and Unofficial Transcripts to CollegeRecruiting@dennisgrp.com. Please reference RIT018 when Applying.",,1/14/55,4/12/11,1
Full Time,104 ft Software Engineer II,"Job Purpose:
Responsible for designing, developing and maintaining Element K web site products by writing hi/low level design documents, generating code, unit testing features and adhering to coding and architectural standards.  Supports the software development life cycle by working with project leaders to establish and tune the applications and architecture, delivering estimates, communicating project status to project manager and working with quality assurance to fix defects and implement change control requests as quickly as possible.  Continually expands on technical capabilities.

Job Responsibilities:
&#194;&#183;Conduct full range of software development tasks including design, implementation, unit testing, debugging and documentation for development initiatives, change control requests and defect correction.
&#194;&#183;Provide technical input and direction for enhancements and upgrades to existing functionality used on the site
&#194;&#183;Work closely with project leaders to implement new features and functionality.

Key Challenges:
&#194;&#183;Conduct a full range of web programming tasks including design, implementation, testing, debugging, and documentation
&#194;&#183;Scope and define new features for tools, utilities, databases, and product upgrades.
&#194;&#183;Provide technical input and direction for product development efforts, specifically regarding web capabilities and appropriate web implementations.
&#194;&#183;Participate in product design decisions, and work with others to implement those decisions. Generate clear and concise design documentation.
&#194;&#183;Assist in the development and review of supporting product documentation and users manuals.
&#194;&#183;Assist in the development and review of test plans for product testing.
&#194;&#183;Stay technically current through reading of periodicals, internal training, and external education.

Knowledge & Skills:
&#194;&#183;Advanced knowledge of software engineering principles and practices
&#194;&#183;Advanced skills in standard design patterns and software programming languages
&#194;&#183;Intermediate skills in SQL and database concepts
&#194;&#183;Intermediate skill in project management principles and practices
&#194;&#183;Advanced communication skills
&#194;&#183;Self directed - requires minimal oversight
&#194;&#183;Advanced leadership skills

Education & Experience:
&#194;&#183;This position requires a BS in Computer Engineering, Software Engineering or Computer Science, or equivalent, applicable experience.
&#194;&#183;Training and experience in Objected-Oriented Design and Analysis, programming, and software testing preferred.
&#194;&#183;3+ years of web development and/or web management experience required
&#194;&#183;Experience in a wide variety of technologies including, but not limited to: UNIX, Java, J2EE, Oracle, SQL Server, Visual Basic, HTML, JavaScript, VBScript, ASP.NET, .NET, C#.


Other:
&#194;&#183;Excellent communication skills
&#194;&#183;Ability to express thoughts and ideas clearly
&#194;&#183;Ability to take and provide creative criticism daily
&#194;&#183;Ability to take direction from Manager when it is given
&#194;&#183;Ability to work effectively with multiple departments in the Internet Technology division
&#194;&#183;Ability to participate in a team environment
&#194;&#183;Perform keyboard and pointing device intensive work 80% of the time.
&#194;&#183;Read text displayed on a computer screen 80% of the time.
&#194;&#183;Travel as required.
&#194;&#183;Read and respond to email and voicemail daily.
&#194;&#183;Read company electronic news and information daily.
Element K is an Equal Opportunity Employer.",,1/15/55,6/6/11,1
Full Time,Teaching Opportunities,"Uncommon Schools
Teaching Opportunities 

Elementary, Middle & High School Teachers
Special Education Team
Specials: Art, Music, Dance, & PE Teachers
Apprentice Teacher

Boston, MA
Brooklyn, NY
Newark, NJ
Rochester, NY
Troy, NY

Uncommon Schools starts and manages outstanding urban charter public schools that close the achievement gap and prepare low-income students to graduate from college.

ROLE
Teachers hold primary responsibility for the implementation and development of Uncommons curriculum and the success of its students. Uncommon is hiring teachers in grades K-12, across content areas, for the 2012-13 school year. 

SPECIFIC RESPONSIBILITIES
Implement curricula and activities to meet academic standards;
Design and implement assessments that measure progress towards academic standards;
Use assessment data to refine curriculum and inform instructional practices;
Participate in collaborative curriculum development, grade-level activities, and school-wide functions;
Provide consistent rewards and/or consequences for student behavior;
Be accountable for students mastery of academic standards;
Communicate effectively with students, families, and colleagues;
Participate in an annual three-week staff orientation and training;  

Valid State Certification is helpful but not required. Belief in and alignment with Uncommons core beliefs and educational philosophy is non-negotiable.

COMPENSATION
We offer a competitive compensation package, including a salary significantly above the district scale and comprehensive health benefits. Aside from extensive professional development, all our teachers are equipped with a laptop computer, email, high-speed internet access, and all necessary instructional supplies.","QUALIFICATIONS
Drive to improve the minds and lives of students in and out of the classroom;
Proven track-record of high achievement in the classroom;
Mastery of and enthusiasm for academic subjects;
Evidence of self-motivation and willingness to be a team player;
Bachelors degree is required; Masters degree is preferred; and
Two years (preferred) teaching experience in an urban public school or charter school setting.",1/24/55,4/24/12,1
Full Time,Internship Sales-Liz Claiborne-F/T,"Overview:  
 Overview of the i experience internship program

The 2008 paid summer internship program, the i experience, is designed to identify, develop and hire top entry level talent. Throughout the 10-week full-time project based program, participants work closely with their managers to understand and impact their specific functions and divisions. Additionally, interns are exposed to various areas of the company through weekly interaction with key executives and networking events.

The internship program is highly competitive and a large volume of resumes will be received. If you are selected for an interview you will be contacted via phone or e-mail. Please review the overview and qualifications listed below.

  
 Responsibilities:  
 The sales department prepares and analyzes weekly selling reports including: open to buy, retail updates, item selling, branch and regional sales and stock rations, shipping and purchase order and disseminates them to the business. They also work on various projects ranging from weekly business recaps and analyzing style selling information and incorporating results into door planning process.","Can do team player attitude 
Strong sense of urgency and attention to detail;
Self motivated; ability to take initiative to complete tasks quickly and independently.
Microsoft Office 

Minimum Qualifications:
Currently enrolled in an accredited college/university
You must be a rising junior, rising senior or recent graduate
Minimum 3.0 GPA 
Past retail or fashion industry experience is preferred but not required",12/13/54,8/31/07,0
