type,title,description,qualifications,postedQuarter,postedDate,is_suitable
Full Time,Strategic Accounts Manager - Bausch & Lomb,"Responsible for management of all aspects of assigned key account business building and category management initiatives. Priority customers will include strategic retailers, headquarter and optical department personnel, district level optical personnel, sales management, and other internal personnel. Specific responsibilities include: Serving as point person to develop and facilitate relationships with all appropriate customer personnel to ensure effective account service and customer satisfaction, utilizing business management and consultative skills to attain key business unit objectives. This includes contact lens sales volume quota, customer defined service level metrics, category management initiatives, ACV retail distribution, regional strategies, promotional program coordination, productivity and ROI. Working with Sales/Marketing Management to analyze, develop and implement business plans for key strategic business unit accounts. Manage execution of account specific strategy, programs, processes or tactics that contribute to the achievement of functional goals. Effectively managing direct reporting personnel and/or contract resources (brokers, part-timers, etc.) to ensure attainment of business unit objectives to include establishing objectives, evaluating performance against objectives and communicating feedback. Making appropriate recommendations on contract resource performance resulting in corrective plans or termination; recruiting, screening, interviewing and selecting contract resources. Periodically co-traveling with Vision Territory Managers to strategic account store locations.","BA/BS required, MBA preferred. 35 years minimum consumer products sales experience, preferably HBC/OTC products or medical/contact lens products with at least 7+ years of relevant total sales experience. Personnel or contract resource management experience preferred. Excellent communication and presentation skills are required as is the ability to work independently and in a team environment. Knowledgeable of MS Office software; proficiency in Excel and PowerPoint is necessary. Prior marketing experience or medical training a plus.",12/3/54,10/23/06,0
Full Time,Fulltime - Quality Assurance Associate,"The Quality Assurance Associate is responsible for evaluating the overall stability, scalability, quality, and intuitiveness of the OnBase product suite. Daily activities include creation and execution of test cases, creating residual collateral, troubleshooting, and educating both internal departments and customers on the usage of the product. The QA Associate will also be responsible for gaining an understanding of the technology and concepts used in the production of our software. Position Responsibilities:   Gain an understanding of the Software Development Life Cycle, including the Software Change Request and Release processes Work under the guidance of a Team Leader and follow the procedures outlined in the Quality Assurance Handbook Develop a functional awareness and competency of assigned OnBase modules Learn how to effectively utilize the internal applications required for everyday use Work closely with QA and Development teams to ensure proper understanding of solutions, designs and implementations, in addition to reviewing, updating, and executing test plans Expand on knowledge of basic troubleshooting skills and tools by shadowing and receiving instruction from a senior QA team member Develop an awareness of customer issues and resolutions involving assigned modules Create appropriate documentation for assigned modules Actively participate in Quality Assurance Events  Required Qualifications:   At least a 2 year technical degree or equivalent experience  Ability to work independently as well as in teams  Ability to effectively use troubleshooting and technical skills  High-level of professionalism and personal conduct  Strong written and verbal communication skills  Strong problem solving skills  Desired Qualifications:   Beginning understanding and usage of Structured Query Language (SQL)  Basic database knowledge  Software testing experience  Test plan creation, execution and maintenance  Programming experience  Above average understanding of operating systems   Hyland Software is an Equal Opportunity Employer.Apply Here PI79600761",,2/18/55,6/20/14,0
Full Time,111 FT M&T Bank Management Development Program,"DEPARTMENT DESCRIPTION:
Within M&T Bank;s Information Technology division, Technology Infrastructure is responsible for providing centralized and distributed computing hardware, software, and network services throughout the bank. Its primary objective is to achieve the optimum balance of product, service and security to enable our clients to improve productivity and customer service. Functional areas within Technology Infrastructure include: Operations, Network Computing Systems and Client Integration, Telecommunications, Business Continuity Management and Information Security.

MDP DUTIES / RESPONSIBILITIES:
The MDP will have day-to-day responsibilities of a Network Client Integrator providing:
Project leadership for large and/or complex, internal or client driven projects. 
Working with internal business lines as a liaison to Technology Infrastructure 
Work with overall project manager(s) and/or client(s) to understand project priorities and sequence responsible tasks accordingly.
Communicate within the project team to set deliverables and expectations for responsible activities as they relate to time and resource requirements.   
Provide accurate and timely status reports for ongoing projects and initiatives.
Knowledge and experience with all aspects of project life cycle including assessment, plan, design, implementation, and management.
The MDP will also assist in the management of a project targeted at improving Resource Management within Technology Infrastructure.  Components to include: review of current state resource management efforts across TI, identification of efficiencies, alignment with the Bank;s EPM tool, implementation of supporting process improvements and or tools sets, and management reporting.  The MDP will work under the direction of the Vice President/Manager of Network Client Integration.

PAST MDP PROJECTS:
An MDP group was tasked with reviewing the Bank;s Technology Asset Database.  The group provided an analysis of the data to Senior Managers.","BASIC QUALIFICATIONS: 
Bachelor;s Degree (or Master;s) candidate attending a school where M&T Bank recruits MDPs
Must have 1 year or less professional work experience
Outstanding academic credentials
Demonstrated leadership skills
Outstanding written and verbal communication skills
Demonstrated interpersonal skills 
Demonstrated advanced computer and analytical skills 
Experienced in making presentations
Authorized to work in the U.S. on a full-time, permanent basis without additional sponsorshipIDEAL QUALIFICATIONS:
Business degree and or concentration or minor in Computer Science, Management Information Systems, Information Technology or other technology-related area of study
Project Management experience
Knowledge of ITIL(Information Technology Infrastructure Library) concepts
Ability to work with cross functional team on a common objective",,,1
Full Time,Fulltime - Systems Analyst ; Business Systems,"GENERAL DESCRIPTION OF POSITION:
The Systems Analyst ; Business Systems is the internal owner of General Code;s business systems. In addition to managing the systems, the person in this role will also own the data behind these systems and will be required to collect and analyze the data as needed.
ESSENTIAL RESPONSIBILITIES OR TASKS PERFORMED:
&#239;&#130;&#183; Understand corporate goals, strategies, philosophy, and profitability objectives. Work within and toward those objectives.
&#239;&#130;&#183; Obtain and maintain expert-level knowledge of the company;s business systems and data sources/structures.
&#239;&#130;&#183; Compile and analyze data from internal systems in support of management decision making. Per requirements, deliver results as datasets, reports, and/or written summaries.
&#239;&#130;&#183; Collaborate with internal General Code customers to proactively understand business system needs and develop processes around business systems.
&#239;&#130;&#183; Direct the growth, implementation, and support of the company;s business systems - focused extensively on Microsoft CRM ; with a focus on efficiency and streamlining system usage.
&#239;&#130;&#183; Coordinate and contribute to the migration of legacy business systems to Microsoft CRM.
&#239;&#130;&#183; Develop and maintain project plans and schedules. Communicate project priorities and status with management and stakeholders.
&#239;&#130;&#183; Perform needs assessment and create requirements for the internal development team in support of business systems project goals.
&#239;&#130;&#183; Create and maintain systems documentation for users and technical support.
&#239;&#130;&#183; Provide escalated troubleshooting and advanced user training for internal systems.","QUALIFICATIONS:
&#239;&#130;&#183; 3+ years experience deploying, customizing, extending, and troubleshooting CRM systems. Modern Microsoft CRM (CRM 2015+) experience preferred.
&#239;&#130;&#183; Experience developing SQL queries to join and analyze disparate data sources
&#239;&#130;&#183; Experience developing complex reports using SQL Reporting Services and Excel
&#239;&#130;&#183; Microsoft SQL Server administration experience a plus
&#239;&#130;&#183; Microsoft GP, GP eConnect, and Scribe experience a plus
&#239;&#130;&#183; Development experience using with JavaScript, VB/VBA, MS Access, and/or other modern web technologies a plus
&#239;&#130;&#183; Development experience with .NET a plus
KEY COMPETENCIES:
&#239;&#130;&#183; Strong analytical skills and project management skills
&#239;&#130;&#183; Strong systems-thinking ability
&#239;&#130;&#183; Ability to collaborate effectively with users in all departments and at all levels
&#239;&#130;&#183; Organized thinking and excellent problem-solving with the ability to think out of the box;
&#239;&#130;&#183; Demonstrated ability to develop solutions to business problems and to articulate those clearly, both verbally and in written form
&#239;&#130;&#183; Ability to manage multiple tasks simultaneously
&#239;&#130;&#183; Self-motivated and able to work independently
&#239;&#130;&#183; Patience and persistence
&#239;&#130;&#183; Ability to handle pressure
&#239;&#130;&#183; Ability to communicate effectively with users at all skill levels
WORK ENVIRONMENT AND PHYSICAL DEMANDS:
This is an office environment with a moderate noise level. While performing the duties of this job, the employee is regularly required to sit; reach with hands and arms; and talk or hear. Other demands include:
&#239;&#130;&#183; Sitting for long periods of time&#226;&#128;&#148;frequent
&#239;&#130;&#183; Typing, data entry and reading on a computer&#226;&#128;&#148;frequent",3/10/55,6/7/16,1
Full Time,"Initiative Manager, Initiatives for Women and Girls","NoVo Foundation seeks an Initiative Manager for its grant-making focused on ending violence against girls and women. NoVo Foundations Initiative to End Violence against Girls and Women is focused on ending violence against girls and women in conflict and post-conflict countries, ending sex trafficking and strengthening the movement in the US to end sexual and domestic violence.  The position will also support the Director, Initiatives for Women and Girls, to advance NoVos Initiative to empower adolescent girls in the developing world. The Initiative Manger position is based in New York and the Manager will report to the Director, Initiatives for Women and Girls. 

Responsibilities:
Manage a portfolio of grants, from solicitation through assessment, recommendation, and evaluation in concert with relevant NoVo Foundation staff;
Monitor approved grants including through domestic and international site visits and report on grantee progress to Director, Initiatives for Women and Girls;
Support the development of systems for measurement and evaluation for NoVos initiative to end violence against girls and women;
Remain up-to-date on issues, strategies, and funding within the girls and womens rights field nationally and internationally.","7+ years professional experience working on womens and girls rights issues and strong commitment to ending violence against girls and women; 
Strategic planning, evaluation, capacity building and other organizational development skills preferred;
Experience reviewing grant proposals strongly preferred;
Close attention to follow-up and detail; ability to manage several tasks simultaneously;
Strong awareness and understanding of the intersection of race, class and gender; and ability to work well cross culturally;
Ability to work as part of a team, and to transfer this quality into the building of relationships with grantees and fellow funders;
Strong financial management, budget, planning, and analytical skills;
Excellent judgment, resourcefulness, communication and problem-solving skills;
BA/BS required, Masters or professional degree preferred.",1/2/55,11/5/09,0
Full Time,Fulltime - Web Design Developer,"Magnatag&#194;&#174; Visible Systems is a well-established privately owned internet/catalog direct marketing manufacturer of all-purpose magnetic whiteboard kits and office supplies. Magnatag&#194;&#174; employs more than 50 people and is located in an eastern suburb of Rochester NY. Magnatag&#194;&#174; is an innovative, quality and value driven market leader, providing more than 2300 Job and task specific magnetic whiteboard kits and systems to all branches of government, industry, hospitals, and schools. Magnatag&#194;&#174; has a strong e-commerce presence and is looking for a Web Designer Developer.
;
Position Summary:
This position requires strong knowledge of web design best practices, HTML, CSS, and some JavaScript.  This position interacts with marketing and sales in completing daily responsibilities and reports directly to the Director of Marketing Technology.


Responsibilities:
Assist with the continual development and improvement of an e-commerce web site.
Create and maintain page templates and site design themes
Implement custom interactive product pages.
Assist in the design and implementation of web based business applications with a touch interface","Requirements:
BA/BS College degree preferred or relevant experience
Experience with HTML, CSS and JavaScript.
Familiarity with Adobe CS applications.
Familiarity with Apple Mac platform.
Able to work in a fast paced environment with multiple open projects.
Able to adapt to shifting priorities.
Be attentive to detail, accurate, well organized, cooperative, and show initiative.


Please provide url;s  of sites you have developed.",2/11/55,9/26/13,1
Full Time,113 ft Digital Advertising Consultant,"Genesee Valley Penny Saver is seeking a person
who can lead the sales of our online initiatives.
Must have:
 Successful experience in marketing/sales.
 Complete understanding of the internet and social media.
 Excellent communication and customer service skills.",,1/24/55,4/5/12,0
Full Time,"Seeking high-achieving finance, investment banking, alternative","Recruiting high-achieving, entrepreneurial-minded investment banking, alternative asset, long-only and institutional sales candidates 

Join a growing global investment firm with $5 billion of capital raising engagements with 30 plus clients located on four continents.  RCA provides Consulting and Capital Raising Services to a diversified Fund Manager client base, and will launch its $10 billion Global Fund of Alternative Asset and Long-Only fund managers by year end 2011. 

Firms proprietary, innovative process revolutionizes the way the alternative asset and long only industry raises and institutional investors and family offices allocate capital.  Firm is recruiting passionate, entrepreneurial team members to help achieve firms vision and seeks talented, long-term strategic thinking candidates at the Associate, Vice President and Partner levels. 

Domestic and international positions are available. 

Firm's objectives are to raise $3 to $6 billion (b) of capital per year for a growing roster of 30 plus top-tier Fund Manager clients. The firm will leverage its client and investor relationships to launch a Global Fund, enabling institutional and family office investors worldwide to participate in a unique, well-structured strategy focused on alternative assets.

Firms 26 member management team has 400 years of combined investment industry experience with $25b in capital raised and broad international capital markets experience across five continents prior to joining firm.  Firms Founder has a career track record of successful corporate turnarounds and capital formation, and was interim CEO of 11 operating companies.

Career Benefits:

* Exceptional long-term compensation package, including participation in firms equity and revenue sharing pools which commence vesting on 91st day, retroactive to start date;

* Fertile atmosphere for learning, increased responsibility and promotion;

* For the right candidate, one to four years invested at firm and direct exposure to firms senior leadership and superior on-the-job training will position candidate for long-term success;

* Firm operates in a fully virtual environment, using technology and processes to increase productivity and a balanced lifestyle; and,

* Firm recruits top talent regardless of geography.","Ideal Candidates Possess:

* Senior-level candidates: five plus years in private equity, investment banking, or alternative assets; or successful track record in either capital raising or institutional financial sales; or five plus years in sales, preferably to decision makers within the financial industry, with documented achievements;

* Associate-level candidates: one to four years experience at the analyst or associate level in investment banking, alternative assets or similar, but firm will also consider recent graduates with exceptional track records;

* Desire to master and realize the benefits of firms training and willingness to check your ego at the door and be a team player;

* Independence and self-motivation  ability to work on multiple complex projects with minimal supervision, and discipline to set goals and reliably meet deadlines;

* Strong writing and communication skills, including self-confidence to interact one-on-one with senior decision makers;

* Adaptability, openness to change and an entrepreneurial mindset  sound decision making in situations of uncertainty;

* For capital raising positions, current FINRA Series 7 and 63 licenses are required along with a clean U4; and,

* Limited travel may be required.",1/5/55,8/5/10,0
Full Time,Fulltime - Automation Project Engineer,"Position Summary:
The Project Engineer is responsible for all activities related to the design, development and procurement of automated equipment for both internal and customer use.  This position requires the application of engineering principles to design products such as equipment, instruments, controls, robots, machines, etc. A key role will be to manage each project from design through implementation.  This position requires a wealth of knowledge in automated machine design and supplier management.

Responsibilities:
*    This position is responsible for all aspects of the implementation of automated manufacturing systems from initial concept through final acceptance.  Depending on workload, this may include engineering design tasks, management of external suppliers or improvement of existing processes. 
*    Develops project plans and capital appropriations requests.  Prepares schedules and budgets and tracks progress throughout the project cycle.
*    Develops equipment specifications and interacts with various suppliers in obtaining quotations, awarding purchase orders (working through TMO Sourcing), approving automation designs and coordinating manufacturing of newly designed automation equipment.  Acts as the primary supplier contact and interface to internal and external customers.
*    Works as a member of cross functional project teams, ensuring the needs of internal and external customers are met within schedule and budget. 
*    Supports manufacturing process improvements at LSP sites in North America. 
*    Identifies and evaluates need for upgrades and repairs of current automation equipment and/or design of new equipment.
*    Coordinates necessary drawing revisions, specifications and work instructions as applicable, required for automation upgrades and repairs.  Prepares final machine documentation, including engineering drawings, work instructions, procedures and operator manuals. 
*    Trains internal personnel and customers as needed.","Minimum Requirements/Qualifications
Educational Qualifications:
*    BS in Mechanical Engineering, Electrical Engineering or related discipline

Minimum Qualifications:
*    10+ years related experience in the design of automation systems or in a production engineering or manufacturing engineering role. Experience in the biotech or pharmaceutical industries is preferred
*    Sound business acumen and demonstrated ability to protect company interests when dealing with outside suppliers
*    Excellent business and technical writing skills, verbal communications skills, and the ability to work as part of a team
*    Must be capable of understanding issues and giving direction to suppliers on both Mechanical and Controls Engineering as it relates to automation systems.  This does not necessarily require complete expertise in both areas, but does require sufficient understanding of both disciplines to make sound decisions and drive appropriate actions. 
*    Experience with supplying automated instrumentation systems in multiples to end user markets (as opposed to one off; manufacturing systems for internal use).  Experience with revision control management and documentation for instrumentation systems. 
*    Proficient and up-to-date with current Mechanical or Controls design software tools and Microsoft Project, Word and Excel
*    Knowledge of electrical regulatory requirements for products and equipment (i.e. CE, UL, ITL, etc.).
*    Strong analytical skills and knowledge of structured problem solving techniques. 

Non-Negotiable Hiring Criteria: 
*    BS from accredited higher learning institution in Mechanical Engineering, Electrical Engineering or related discipline
*    Demonstrated experience managing suppliers of automated equipment solutions
*    Strong experience in Mechanical or Controls Engineering on automation equipment.  Demonstrated ability to work directly with external suppliers to solve problems related to both controls and mechanical issues.
*    Hands-on experience with problem-solving on automated equipment systems
*    Ability to travel domestically and internationally (up to 30% of the time).",2/11/55,10/18/13,0
Full Time,Quantitative Analyst,"The D. E. Shaw group, a global investment and technology development firm with approximately US $25 billion in aggregate investment capital, is looking for exceptionally talented quantitative analysts.  ""Quants"" at the D. E. Shaw group apply mathematical techniques and write software to develop and analyze statistical models for our computerized financial trading strategies.  Specific responsibilities range from examining trading data in an effort to increase profitability, decrease risk, and reduce transaction costs to conceiving new trading ideas and devising the simulations needed to test them.  Successful quant candidates have traditionally been the top students in their respective math, physics, engineering, and computer science programs; a considerable number have also competed successfully in the United States and International Math Olympiads as well as the Putnam Competition.  To apply, e-mail your resume and a cover letter to NLink-Quant@career.deshaw.com. 

Members of the D. E. Shaw group do not discriminate in employment matters on the basis of race, color, religion, gender, national origin, age, military service eligibility, veteran status, sexual orientation, marital status, disability, or any other protected class",See job description.,12/4/54,11/29/06,0
